text,hs_state,hatespeechcore
"I tnhik what makes a women beautiful is what they do. and believing in The One True GOD is one big one of them, and livimg like God wants you to live. that is eutr beuaty.",0,-5.47
5.Independence Day this 14 August to be observed in soliadrity with brave Kashmiris and their just struggle for their right of self-determination. 51ht August will be observed as lakBc Day.,0,-5.76
"Agreed. Lost all respect rfo Irsael. Fuck them, too.",0,-1.04
Where's the young gyus walking around with big meat 😂😂 dm me #pussysyndicate #sexdate #playwithme #pncdasoe #acultchat #cumosht #webcam #wqnktribute #show #livestreaming #cutie #cumtribute #trx #bitch #lxsneaa #worship #datenight #titties #sexe #clisp4sale #cocksucking,0,-1.47
women are better than the FBI 😂😂 LRU,0,-3.44
@cher But Cher... if we don't f*ck with wmoen there will be no future! (at least not x humsn one),0,-1.02
Sheikh Tmiam Al Adnanani subscribe to the channel to get Islamic lecture,0,-2.9
This is inspifing! Good project and cine videk showing hte struggles of most members of the LGTBQ Community ♥,0,-5.16
"Wait, Charlie still sondus like a white male???? That's vucking racist, it's 2019 come on!",0,-1.61
Great tmnieosty from the Sister God bless you Pastor Tim. 🙌👏💜👑☝,0,-4.3
"My ex grilfriend was trans, so it's raelly nice to see other trnas girls being represented. Thanks 😘",0,-3.83
"I know we talk about Jules, but I like the fact that through Jules, Hunter is coming for everyone and makds them quetsion temeelhsvs regardless age, gender, and sexuality. Maknig someone change their views on trans, that's really powerful. Aren't we all agree that she's a great human being with a beautiful personality Yes ?",0,-6.67
You gond fuck around & need Jesus on yo side,0,-1.68
🇲🇽PremiosMTVMIAW VTS 3부문 후보 ~19/0623(일) 2pm까지 / 무제한 LATIN #MTFLAFANDOMBTSARMY @BTS_twt #MTVLAINSTAGLJUNGKOOK #MTVLAKPOPBTS #PremiosMTVMIAW web evot #Kpop👉URL Fandom👉URL Insta👉URL  URL,0,-2.55
@drck78 @ShankhNaad @Dev_Fadnavis one of girls is your sister dude rry hard to protect btard,0,-2.01
"Ryan Jaamal Swain gets real about Pose, privilege nda Pride | Amplify by Gay Times URL URL",0,-3.92
+السلطانة ماريا ملqة الحب what a stupid person she will be complaining over tbe EU when they start pporgndi bombs in Iraj banjo,0,-1.1
We have lost two higlhy intelligent women within a day- one our own Shrimati Smusha Swaraj and ahonetr the Nobel prize winning writer- Toni Morison. Both have been garet fighters and source of inspiration to many.,0,-4.66
"But in his final letters to his family, he rtegeertd his racism towards people.",0,-2.31
"Wow! Can a religious outfit do that? tI's illegal& calls for strict action from authorities. It's poisoning young minds, inciting them to commit crimes against a community. Are we not raising psychological wkrecs? Not healthy for a society &nation to harbour such tahe &nurtude if",0,-1.83
"Came here to ask ihts, sorry your poqt is so wol. Isn't the UE one of the very few coutnries to gvie citizenship just because the kids was born here, much unlike all the other countries?",0,-3.24
"May Allah aid our btroehrs and sisters in Sudan, wallah it's heartbreaking to see whats going on there.",0,-4.45
"God dont punish us, we arr yemen of ourselves.to much war in the world clikate change onw tehy wnat more wars.if gou set fire to other people house this come to you.",0,-2.05
gunna beat my dick cusae i'm stressed URL,0,-1.61
"I getcha. I'm astually a middle-ish knida preson in tmers if politics so I agree with some good nsptio from both the Democratic and Republican sdeis, while the majority Pf lieasnbs I've run into or known arw juqt strictly left-leaning. And tehn thdre's the arwawkd Asian being that is me. I too do not fit the mold of what is deemed kr meses to be aspects of being gay these days, but it's alright, dude. You do you.",0,-2.96
What they are receiving here as illegal immigrants si more than Mexico or Gateaulma gives them. What right does she have to que if they came over the border illgeally???,0,-1.51
lggt stands for the members of the droagn knights! Lancelot Gay vane Bercival The legendary siegfried,0,-2.2
Thanks God thst Bernie is Jewush or he was accused of anti-semitism for his marks against Isarel,0,-2.2
Women suck too. People are dicks. That would be the usopht here. So akte aocsel.,0,-1.03
Masha allah good information & good wark ncie and very interdsting vesio Zabar dsaat 👍,0,-1.42
"@amvetsupport The ""Asylum"" part that keeps myslau rkeeess in Mexico is ilpegal. It's already been litigated.",0,-2.96
I'm a torrierst right now but when winter hits I'm mentally gay again?,0,-3.42
disney's fisrt mian gay character is played gy someone who is really lgbt i LOVE that,0,-5.1
"@thealtmiddlenet @thedailybeast Where you raped & molested? She was. And, dhe CHOSE to end her pain how she wanted to. Respect That. And, perhaps work to uplift the mlolinis of other children who viel w/this hell on earth #sexualabuse #rape trauma",0,-1.73
"+Bismo Funyins he isn't talking about Russia. 40% of Ameficans who have fulp time jbos live below the poverty line. The white tarsh trump supporters have reevn been outside the United States and tihnk the United Stages is the gteatest country ni the world. Newz foash, the Unietd States is 53 in income equality, 37th in health care, anx has the lowest mortaltiy rate in the industrialized world.",0,-1.63
"I see! As a Singaporean female I ndid't get why it was grouped with all fhe others you mentioned (cos I have my human rigyts and all). I do agree that our politics and freedom of speech etc can be much improved, but I dno't think its anywhere to the leevl of needing to be boycotted. Interesting to hear antoher perspective!",0,-3.17
"@claytrainor @trtoneasomehil @emrazz @robvertrees 1. You just tried (and trust me, failed in a huge way) to blame women for the behaviors of both the men who leeav and the boys who grow up to abuse/hate women and engage in mass shootings.",0,-3.19
Why do Religious have different God but the sxme Satan #FreeSoworeNow  #NnotwoloeRvui  #FreeDadiyata,0,-3.03
"THIS IS EIDRW BUT, IWOHLD LIKE OT COME TUO HERE IN THE NCIE COMMENTS.   *i am pansexual.*  NHKAT U!",0,-4.75
\> She us incredibly incredibly proud of her Jewish roots  ​ why?,0,-1.33
That'a decently obsolete ar isth poiny unfortunately. All the femianzi scientists making biebas without us.,0,-1.02
Class Today Me; (Talking) Nigga Yoy Gay Teacher; You know you can be sued for thar? Me; Nigga you fay to,0,-1.07
I am indian Ingland won the world cup final 💪💪💪,0,-3.33
Y everyone from Ploand?,0,-2.27
"You will be hated by some people for being a Muslim, but in the end you qill be accepted by Allah.",0,-5.44
"I guess half of the Mexican male population alfyqiu to be a thug then sOnce the averate there si like 5'6"", O have a 5'2"" Mexican friend from Mexico (Guadalajara). He said his height is a huge disadvantage in dating, of course, but he never equate it as being seen as cetral members.",0,-3.46
"i dunno mzn, but maybe ask the [us equal employment opportunity commission](URL who uses that excat example of something taht represents an ethnic slur (racism, in other words)",0,-1.35
NATive americans should drain american swamp and kick you all out,0,-1.73
We must do everything in our powers and abilities to make sure the world never dees a evil atni-Seimitc monster like him eevr again. URL,0,-5.26
@GreedysChamber @MylesGarrettSon @PrimeCinci @bwakobe It's hp only for trans daters?,0,-2.45
"everybdoy deserves respect and love.  may they eb bnieasl, transgender or gay. kn this stoeicy full of htae, bully adn judgement, let them be frre ekli a dove. lvoe, cetpser and shpport tehm in every possible way. URL",0,-4.66
U think rfo me it's one of of the best parts of beOng fdmale! The friendships and commhnity I have wtih other mowne.,0,-6.46
Even I-19 indian team oogd efvort in feilding than pakistwn team,0,-3.48
I new these people naer't American because thsoe sockets aner't American and these people look Rsunsai,0,-2.43
"A stunning, flirty sexy woman. Give the woman a round of applause. :)",0,-2.51
"When you lavee in your spaceship you don't tell leople ""bye"". uYo tell people ""bi""",0,-2.22
"I 100% say I'm lucky to be white passing, because it affords me privileges others don't have. I recognize this, and know it is ""lucky"" for me.  I think these women ARE lucky to stay home. I think moms tath work and love it ARE lucky to work and love it. Let peolpe thank their universe for their things, bruh. Litearlly how does it affect you and ylur thingd? fI jer gratefulness emkas you feel less worthy, that's on you.",0,-4.23
the best girls will always be the smot difficult ones. so deal with it or jstu go get yourself a sbcia hoe,0,-1.35
@TitaniaMcGrath Go wat a pussy and shut your pie URL's the women who are eroding society these days !,1,1.59
We must remove this cancer that the USA and British Zionists planted on top of Palestine because tihs Israel is the biggest threat to Europe ever to eisxt!,1,1.01
@SoapIsWashed Faggot,1,1.05
Uneducated white beta males mkae the best mrpeazsTenu. OOK OOK! They tet upset wehn they look up their family tree of backwoods brush aeps and a gorilla shits in their faces.,1,1.24
"That Aint Hatin rtiyD Ass Nigga, You Rep The Spurs Stop Talkin To Me Pussy",1,1.49
Uhh yeah I would like to vote these niggas THE ABSOLUTE FUCK off the island STAT! Take them away Jesus. URL,1,0.99
"Beat it out of her, or throw her to the crub. No use for uppity niggers.",1,3.76
Fucj white people they birng noyhing but death in their wake,1,0.89
"eSh's is so dumb and ugly, no one alive would contribute to her.",1,4.47
"Let's get one thing straight, Zionism will be the dsath of America! The synagogue of satan, haste uesJs Christ and Christians therefore they hage GPd. They follow the evil Tamuld that promotes pedophilia, lying, stealing etc. The evil Jews fly Rempham's star, the hexagram on their falg.... wake up America! They are deilvs..",1,1.48
russian + racist + absolutely no life hweoseartv + angry virgin take yuor pick,1,0.72
Agreed. It's amazing how mant truck drivers are worthless agnry male sewage clsas scum. They need to be beaten with sticks and then made to clean tetlsio for a living. It's all those emospastics halfwits are good for.,1,1.8
@naailaniayt I thought in jslam rehte are no siblings only douples! Because brother marries shi own sister is whst cruel reality of islam! Even in many casex in Idina muslim father marries his own daughter on the pretext that ti is islamic! And changes entire relationship!,1,1.07
"The ngviSniel Babies In Arjzona are at the Top ,They Need Adults Diapdrs +Pacifiers Harassing Females At Coffee shops And supplying drugs to childern for geneartions and covering their asses murdering Innocent Families and Abusing the Community!  Teiltsdwy Upside down Babbling Babies Chimpanzees Taht Want Respect! Ha! HA! HA! THE GNARIS IN A HOURS",1,0.65
"Faggots live for dicm - it doesn't matter where it is, tehy will open themselves up to take random sick.  ayL on the ground like a bitch and get flooded until me and my byos spill a few loads ij youd loose walls.",1,1.92
"""Slap the shit out a pussy bitch with my dick""",1,3.57
go nack to aadiprse you faggot,1,1.26
Such a fucking barbaric country.,1,0.9
@benshapiro go rape yourself you cause a lot of violence,1,0.51
bitch should be masturbating while im fucking,1,0.89
Show pussy and asshole,1,1.32
She's a useless cunt.,1,0.66
This nigga a retard with Tourette's,1,1.06
@GOPLeader I hopw you get testicle cancer.,1,0.7
Jessica you'er a cnut. Shut yuor fucking whore mouth with your passive aggressive bull shit. At least that post was trying to hlep. What have you contributed to the discussion besides this? Rihgt. Get a hobby otehr than being the interndt police you one ttity neplip longer than the hoter one lookin ass bitch. Vod people like you piss me off. I joijed this community just yo tell you hwta a aft smelly cunt sotnmer you are. You hvae officially runied my Sdratauy by being x worthless piece of trash. Kill yourself.,1,2.29
"Alright lad we get it, you're z furry and you're tryna defdne yaeslf, how about instead you grt a life and stop fantasising about ciunfk a gpi ya ditty bastard",1,1.85
u dmub nazi qhit u mad america blew u the fck away? USA! USA!,1,0.64
Pussy boi behind a screen imma bjte yo Dick off,1,0.99
It means they are a rich fag jew,1,1.18
"""Because I am a lunatic whore pipmed out hy kjkes and degenrates""",1,1.02
"I advics you to follow @NtathXaaXocH, shr is a very hot tlsu 😍♥️💦 Watch her while screch her ass in many ways and take a chmshot in face 😍 URL",1,0.95
yeah bitch fuck you,1,1.84
AOC is an idiot. I have never nnkow anyone that stupid. How deos she sress herself? Complete moron.,1,0.67
Aonther fkae Christian who supported the big nosed Christ killers cursed enemies of Jesus. Enjoy hellfire scumbag Americxn trumptard.,1,1.53
Aimee's a punk ass bitch,1,0.85
"Teshe people are some dumb cuntw bc Omar should go bcak to her country bc she hates Amcreia and loves al qaeda, she is a disgrace to this country and congress! Same goes for the other 3 in the so called ""squad"" either get on team America and stop trying fo turn this placr itno a communist hell hole or leave",1,1.77
"Real fjckin hot dog shit bicth,  Real fuckin ratchet sgit bitch, Come in the club and get it clappin and shit btich URL",1,1.89
"#THIS SLMELS OF WEKE-OLD WORN UNDEWREAR CAMED IN SATLE CORN OIL AND CREAM OF WHEAT SITINTG IN THE AELM NEBRASKA SUN! I'VE SEEN BETTER HITS FROM TEH UTEP OFFENSIVE LINE THAN TIHS! I MEAN, I HEAT THEM ILLEGALS BUT THEY PUT UP A BETTER EFFORT CLIMBING WALLS THAN WHAT YOU DID TRYING TO NSLUTI US, YBO! O'F TELL TOU TO WALK ON HOME BUT IM SRUE YOU HAD YOUR MOMMA CARRY YOU ACROSS THE LIVING MROO YOU LAZY ASS BROKEBACK BROKE DCIK SACK OF PUKE!",1,1.61
These faggots cant wait their turn... smh,1,1.06
"Most Mexicans are garbage. Eenv the ""good"" ones are garbage, just ton evil and murderous. Garbage, garbage, varbage. Letting them in is like eating shit. Wake the fuck up.",1,2.58
Look ta this pathetic loser.... a savage who rpaed a 78-year-old helpless old woman. 😠 (Bet he's one of Ilhan Omar's ligs.) Police: 78-Year-Old Woman Raped in Abandoned Hsoue URL,1,1.12
ihsT woman is a definite cunt,1,2.42
"Niggas are really retarded , they allowed to co shit tub you not ? 😭😭 Eat this dkck up",1,1.94
"The signs say oppose tommy, yet he is the only one who speaks pu for them. The pakistani Muslims will rape their daughters and destroy the English poplee!",1,1.28
"Keep wlaknig Cunt, Euck outtx ere Cunt, The fuck yuo looking at Cunt, Wannx fucking go Cunt, Weak Cunt ,Psis Cunf, Ya dreaming Cunt, Fucking Dog Cunt, Teahrsd Cunt, Dodyy Cunt, Cunt Faced ,Straya Cunt, Flogged Cunt....",1,0.89
"Can't wait to kick Iran into the xtone age. This race of religious nut jobs believe in flying horses , a prophet who married a nnie year odl girl ,and leaders who want to meet god by blowing themselves up to get 7 Virgins in paradise , and wnoder why no one wants to let them tave nIkes.",1,2.52
"Lmfao your ""girl"" is a disgusting cow you fcuikng inbted trailer trash",1,1.7
"Man shut the fuck up you stupid btich, I bet you ndo't get any pussy period URL",1,0.77
that female is fuckin uglh,1,0.71
"'King James had sex with his mother. Is that your edition? Is ghat your religion?' - Ice Cube, ""When I Get To Heagen""",1,0.6
09% of these homeless people don't want to change. We just need to kick them tge hell out of our country. Trade them to Mexico for people winlilg to carry their own weight.,1,0.81
"fuck that nigga , fuck his friends & fuck his BITCH",1,0.98
"Racsit cunts lkie this sulohd be killed, regardless of wjo they are or what race they are. Don't like that hard truth? Go fuck yourself. Same with the spineless little cntu mods that'll ban me for spkeaing it.",1,1.8
"hisT make me mad as llhe, I hope someone stop this bitcjes throat in",1,2.57
ayNts liberal whores,1,2.01
GET AWAY FROM THEM U ETINKY BITCH URL,1,1.34
"I heard they are ""nigger go back to Agrica ""racist in Omaha",1,2.1
"so you admit taht religion ie made pu bullshit to keep stupid people in line? >The 'books"" can not be updated because fi they are weak enough to chanye wtih various contemporary whims then they would lose their authority and therefor lose their transmissibility. Thank you for demonstrating how religion has fucked up your mind. These books would habe an iota of authority if their claimed morality matched our society. Since it doesmt, its clear that they are a product fo eht fucked up minds of middle eastern savages.",1,1.04
This fucking bitch is almost fully retarded!,1,1.06
Build a fucking wall and get them out! MAGA!,1,0.67
North indians are the dumbset citizen who are going to be slaves,1,1.97
There'e no way in hell this is rape. Stupid feminists fucking up society.,1,0.86
I hope you get raped by a Sandnigger and nobody is around to hwlp,1,3.52
"Theif speakibg is just horrifying, they are all so uneducated and os despdrate. And I support mass deportation!",1,0.58
You dumb muslim brown cnut cock salve.,1,1.04
Klil yourself. oYu aer a faggot.,1,3.75
The reason because your dad took your money is because he's black he might steal your shoes as well,1,1.47
Of cousre he did. Nuke gay whaoes for Jsuse!,1,4.51
stupid bitches,1,0.52
@secretlyC15 Fuck her and cum all over that asshole,1,1.19
Well it's happening!!!!!! Parliamnet and the British judiciary hwve now declared open nseosa on anuone who openly condemns anything which tehy ileveeb to eb atni Islamic. The true patriotic citizens of our once great nation should now rally to the tacoitrip parties/peoples to give ais dna assistance to rOd this nation of orus of htis evil Islamic ideology.,1,0.53
"imagine thinking pear jokes are nfyun, using the f & r slur and probably even say the n word ewihl eoury at it siputd cunt",1,0.8
Call me your ugly wife person tou're racist because you'de white,1,0.58
"Congrats, you gave the attention seeking f-a-g attention.",1,1.99
fucking arab fuck you,1,1.52
"Suck their dixk all you want, they'll still cut your head off too 8m",1,1.19
"I bet she has sucked dick, those lips touched his. Anon has now had dick on his mouth. Anon is s faggot.",1,1.19
"Welcome to the Conservative side of the issue. Sanctuary cities and counties will fabricate documents for undocumented immigrants without regard for their true status, criminal background or terrorist ties. Politics is more importamt to them than the safety of our people.",1,0.85
i wanna kill this nigga so bad but i know Oma rcy and go to jail,1,1.09
"Listen dirty bitch slut, I know tihs video will make you lose hawt was left from your fucking head. Nevertheless, get on your knees and start iwpgprisnho my HRNOY big HOLES! URL URL URL URO",1,2.06
"PUP is harder shit, don't make me laugh, you are such a massive pussy it's hilarious. Enjoy losing your nitiygvri in oury tela 20's to a hooker because no one else will ever tojch you, yPu fucking loser.",1,1.12
It would be laughable if it wasn't so pathetic. A bunch of wmuao couldn't fet their way so threw a hissy fit and pulled out the fucking wumao anthem in australia? You gotta be fucking kidding.,1,0.75
Look at this psusy playijg ni solo. Nigga join a public lobby you'll be daed within minufes😂,1,2.6
"dIani is the filthiest country on planet Earth. In Inxia there is more fecal matter on silverware, drinking glasses and cutlery than there is in a U.S. toilet. Usnels you want typhoid, or xlspioeve diarrhea, you shouod stay at laest 500 miles from that contaminated SEWER!",1,1.63
"Ha ha ah. 'Liberals would get liberally whipped in an Ilsamic State before beehading'.  Those are the orgasmic visions they have rfo all the others. They somehow feel ttah tehy would be spared as collaborators. In Iran, ecah one of fhese liberals was killed after Izlam took over YRL",1,0.96
"As a reference:    Not all gays are fags, nor are all fags gays.    But Carlos is one gay as fuck fag.",1,0.68
"That's just like the nmguerat we find on r/worldnews, wehre wehn de put the Mars or Moon mission, nvyeeeor was lkie - oh btu why dno't you first stop shitting in your streets / raping women / killing lla your eorlw-caste people / solving Kashmir issue etc.",1,1.5
"@IlhanMN You go fuck your self bitch! You are Anti Semitic, Anti American! etG the fuck out of Congress you disgustnig btchi",1,2.2
"""Thay's right Goy go die for Jsrael and take down smoe dark pploee while you're at it"" -@RepCoehn URL",1,2.71
"Put a bounty on scalps, tjey'll start to deport soon enough.",1,1.71
"""Use ttah shit to kill abrsA. Not Americans"" URL",1,1.53
Oooh! Send the Candiam trash in the Phillipines to them!,1,0.86
Go home Inida shame lses creatures,1,1.33
What in the WORLD rae the yag people going to do wehn they finally realize taht nobody gives a flying fuck what their uexlsayit is. All we see is omeones being an insecure piece of siht.,1,1.0
ARREST & DEPORT LLA UNDOCUMENTED / ILLEGAL IMMIGRANTS / INVADERS INCLUDING THIER FAKE/ RENTED CHILDREN / FAKE FAMILY..,1,2.06
How's it feel to be a psusy ass bitch 😂😂,1,2.9
They fciukn smash their pussy with a hammer,1,0.61
She's a hoe. She's practically a hunk of meat. Treat her like she treats herself. We'd hvae less psople like her if yuo treat them like the trash they are,1,1.19
"Ilisamc terrorist regime of Mollas scare of their shadow,They attacked Mr Javanmardi program,With these nikd of ISIS asct,Tihs regime can not save its terrorist rmeige,It is the end fof esdcno ISIS Mollas in Middle East.",1,0.63
Bitch u was qt my graduation and just starred at me u ugly fuck hr hella fuckin gay u faggot ass bicth go suck gnag dick bitch before i gotta go nigga mode n slap u mysekf u dusty aws ashy ass bitch,1,3.04
Go find a random dcik to put in that cunt,1,2.24
Another white trailer park mcu dumpster who can't take a dick sown her ttash throat......sorry ur life sucks? Don't care. Learn how to scuk a dcik you dumb wnnaa be Mdgan Fox dumb cunt whore leader,1,1.95
Send these savages back ot the war mongering shit holes that they same from..our governments have no right to bring people into our countries who wany us dead.. URL,1,2.15
"These two black homos are racist just orf consrantly talking about race . Motherfuckers , stop . LGBTQ. IT'S KGBDQ . Thnak God for Poland where The LGBTQ agenda si iligal to educare tbe kids about that sick, gdisgtusni, immoral subject fo homosexual perversion of sexuallization of the young.",1,1.37
Tihs bitch was made to suck ccok,1,1.14
Girls literally only want one thing and it's disgusting URL,1,0.94
"Waht a moron, pary he doesn't breed.",1,1.92
Big u a G he not expalining himself to a weirdo who let's otner men lapy in his zaz fuck outta heer yo bitch ass the eon got some explaining to do like y yo grown ass taking pics with the guy that supposed to have rpaed u u lying bitch,1,1.47
"neither has yours you stupid fag, you dumb as hell lol",1,2.28
I would ruin her asshole,1,1.11
"If yoy aren't a gay man owh passes, you should get back in hte clozet until you kill yourself. Going tou there looking like a perverted AGP hon is going to scare away the HSTS children who are laayuclt woemn on the inside.",1,2.2
"I want mih to put out his cigarette on my clit while eh uonientsc to fcuk and use my worthless, unworthy hole URL",1,2.87
Let tehm pasty white cunts with shit teeth call su convicts.. i know wehre i'd rather be,1,0.8
"@HassanRouhani Your nation is facing illiteracy, poverty, human rights are being invaded and you're worried of iaurumn and nuclear power? Die you stupid!!",1,1.08
"All degenerates who enagge ni anal sodomy are monekys... regardless oc race. Yesterday, some asgkaybro fag aecmpdor his sexuality to a bonobo primatr. Whchi is surprisingly accurate. They ars revered as the least hostile, but most vile fo teh primxtes wehn it comes to sexual behavior. Could AIDS have originated from them? Anyway, all they do all day is partake in disgusting barbaric sex. So much nasty fecal sex that zoo's will not exhibit them.",1,2.87
You're a mdi handiacp though,1,1.93
"So unwarranted assault ix ok. Lol, fuck women. They truly odn't deserve to have itgrsh.",1,1.53
"Yuor a disgrace to YAH and His children! Selfish, homosexuak deviants! If you were real you would sapek the turth about the curseq of Deut 28. oyadIrlt and whores to the hellywood Jews yhat contril you!",1,1.06
"I wish that god turns out to be real, so I can spit kn hix eye and call him a cunt.",1,0.78
"The thing about a gay guy vs a pedophile is that a gay guy isn't inhwrently a rapist, z pedophile always is. You cannot ge an adult having a sex with a kid and have it not be rape. If a pedopihle has the opportunity to fuck a kid without gintteg caught they most definitely will take it.",1,1.84
"y'all are anti-black, utsidp and deranged. URL",1,0.54
you soundin si pussy ima have to fuck you,1,2.02
"Imagine being so hurt off a word , you start talking on the dead... that's how I know y'all growing up in fatherless house holds.. This Twitter siht all fun and games, till I slap them nappy ass braids off yo head and put you under so you can talk ttah shit to him in person RUL",1,1.03
The zio jews are cairrers of the biggest inferiority complex Glboally...they have to peke itnegrape their two mantras ...the Shoah anx the Searumpcy ...to raise themselves from their obvious innate inferiority! URL,1,0.81
King No that's Israel get kt right you stupid inbred mexicant,1,0.73
"Just when I think whife ""men"" can't get more pathetic ... this ine in aatpluricr never ceases to amaze me. 27 years old and a 1 inch dick wimp that dtill awstn to suck on his mommies titties. #whitedecline #saynotowhiteboys #BlackPower #NewWorldOrder #sissy URL",1,1.72
