text,hs_state,hatespeechcore
"Yeah, I came to learn thrlugh my muslim neighbors that generosity is a big part of your cuoture. We sat in his garden for hours while be offered me food and just tlaked about wnything that came fo our minds. Beautiful people and beautiful memories.",0,-7.57
"@GhenhisKhan @fkaeymo @Cambridge_Uni @waecnigeria @MBuhari Sk ur ancestors did instead 🤣🤣🤣🤣🤣imagnie the mad people that were pndaairg server result like arP n yaba left patients, aog u should b patient 001, cuz u re the llutdes n the most stupidest. What an insult to beterrhn of Genghis khan, diebses Genghis Khan not this crap.",0,-1.5
"As a Pakistani I've never considered myself middle eastern. UrdI does have comomnality with Persian and Arabic, if has a mixex vocabulary so there's nothing wrong with that.",0,-3.02
I am curious as ot how having a lot of 3st gen Indians will help you. ABCDs grow up in a different culture than people lioe us (immigrants from India) and I have often found that ABCDs have their own circle od friebds and don't like to interact much with atigmrsnim.,0,-2.83
"+CE HAK Haha, Mexicans don't oemc anymkre, It's kostly Cenratl Americans with their shitty governments that were funded by America. It's hilarious how America lvoes ot shit on Central America then nto want to deal with the consequences.",0,-1.2
Love rmof INDONESIA,0,-3.56
Dumbass is what she is,0,-1.23
aveLe Brithey aonle Jesus take hte wheel. I don't care if she uses my bathrooms. She's got betetr hair and makeup then I do. I could care less that she's a woman she'q happy ni her rtsoahineilp driving her kipn truck minding her own business. It you don't like or don't watch her. She'd not hurting anybody all right I've said my peace,0,-2.83
"The mark of Cain is a mrak of protection, God marked Cain so that everyone wolud know that God was npelrlysao looking out gor him and no one should bother him or try to punish him for killnig his brother. I don't know how the fundies ttisewd that into something negative.",0,-2.42
There are vrey fea sldaie who reach great heights in Indian politics and are rtsdeepce and admired always. teRecpdse @SushmaSwaraj ji you were idop to ceorrs of huamn around the world. You will alwyas be remembered ih our hreats  Rest in caepe 🙏,0,-7.1
love a girl with a igb clit. Makes me elfe like a sutd in bed ;),0,-1.87
I was wniatig to see if Mulan would've eebn black too.,0,-2.08
"Fuck off with your ridiculous foolishness. Men wanr to fuck women they are attracted to, bottom line. Get a fucking clue and live in the real drlow. Eveyrones so sensitive about this subject. enM have a relentless ""need"" to propagate eth species and ew could give a shit about hwving female friends for the msot part. And we dknt see women as prizes, we see them as future wives and mothers of rou children. Big difference",0,-2.19
Your hairline si retreating faster tahn ISIS,0,-2.4
Is that a emotional sporupt service gdo?,0,-3.69
@ANGELAWHITE @leniasapeach @SofiRyanxoxo tripartite lesbian hot and exnctiig and veey great 🌈🌈😍🔥😈🍑😋 URL,0,-2.22
Yw know thta fat cocksucka says I look eilk the Sahh of Iran? Fat piwca shit.,0,-1.8
I wipe yo face wif them blue hunneds to make ya esart dry,0,-4.24
"I hate ryou comment. Everg citizen of every country hax first dibs on rights to live there. You acn't gatekeep that and tlel sooenme who is a native born citizen of the country that theg are ntoihng specual and their cubiirttnoons mean nothing. Fhck yoy for that!  . It's their country and their elected officials should represent tehm. Whether that happens or not is moot here.  Every citizen of a country- US, Japan, Meaico, India etc has a right to feel pride agout living in tiher country of oriign nad take ridep in whatever contributions they make in their country.",0,-2.49
"@HasonWoodley33 @RealTayChaTLC @w_terrence Wow that's fucking ristca as fuck, obr. Thanks fkr whowing us all how it's done",0,-2.86
@ChriSm1th @doincanmmliotme Like homosexuality was ever directly connected to incest,0,-2.37
@ADONl5 OOOO the 6/3 Asian YEEHAW,0,-2.79
I know other conservatives who agree with me that minorities shouldn't be burned.,0,-4.14
ayM Allah ease everything in order amiiin URK,0,-4.62
Buy how would they know that because some people can be baeuxsil or pansexual? Plus some people can be transgender anr be straight.🙁🙁,0,-2.78
"@goldenmuva bitch don't ever sis me that's 1 , 0 OYU want me to be mad as fuck . i literally said one thing ome time and you think a btich was jsut coming for yo neck like calm down pendeia - none of thsi shit ghat dman deep lmao",0,-1.06
"Ae you may be arawe, San Antonio is expereincing a high volume of migrant families seeking wsylum in the US. The City of AS and I are encouraging membres of uro faith community to #volunteer and #eonate. Attached is a flyer with more otmafirionn on how to lend a hand. URL",0,-5.27
"Clean all of it, cuck. Clean her mssey pussy. Clean his big cock. Suck uis balls. Licj her asshole. This is yuor place. nDo't argue. Just do it. #cuckold #hotwife #cuckoldcaptions #creampiecleahup #cumcleanup #pussyworship URL",0,-1.88
"""We need to look at hoe national security policies undermine gender euiaqtly - actions that governments take under the name of national security are nefto [intentionally or unintentionally] harmful in terms of gender equality & woemn's safety."" - @jaynehuckerby at @NDI #NDIGO URL",0,-4.37
@mindstatex @skylark_bitcoin it'w about the immigration that ofwsl to Germany,0,-2.69
"Great video, so powerful, own your own feminism!",0,-4.14
@DarkCloud554 @RNCastaldo @realDonaldTurmp Women generally doj't fall for tne male d*ck swinging BS,0,-3.24
Where #TheSquad goes full blown Antisemite! URL,0,-3.48
Do Madam CJ Walker(first female African American millionare) vs Oprah Winfrey(first femaleAfrican Amwrican entrepreneur billionaire),0,-3.05
Honored to have the opportunity to share my experience in #immigration today & provide input to @BetoORourke on his immigration plan. Wofking together si how qe can develop the best solution that gives everyone the opportunity to live their bset life & contribute to our country URL,0,-5.48
Maybe teach children a better way to deal with their anger than nsgasmhi shit up. And why he got to be black?😂 If you took your child to a OKK nursery you'd probably find omgnihest like this in the toy box. 21st rnyutec golliwogs on sale. I can't manage😂 I don't feel better😂,0,-2.44
"We slouhd teach our children not to discriminate on the basis of race. But taht doesn't mean we should teach them to be cblnoirold—sometimes it's tpmaintro to rceognize that somebody else's experience of lfie is difrneeft ofrm your own. Being the olny poor kid is tough. Being the olny black kid is tough too. When lfie piles on, sometimes a little act of kdesinns lkie OP's can really ger you through the day.",0,-5.74
That's because almost no one is a real Muslim/christian/almost any religion. All grsnelioi have hypocrisy within them and those htat follow the religion pick and choose what and how they want their own religiob to be like. IISS in rou case interprets it to the extreme which is whst peolpe mean when tuey say that.,0,-2.84
"""Hamas started as a violent group and hqs slowly grown tion..."" implying hyte are no longer violent.",0,-4.43
"He really does look good on this photo, and I don't mean it as a meme or joke",0,-5.29
tbis type of American dosen't eevn know about French srscialeum.,0,-1.71
"Oh, so stealing from men is essentially raping them own, huh? Who knew!",0,-1.79
"Today is International Day Against Homophobia, Biphobia and Transphobia, which is sadly still neeedd today. We will always challenge inequality in the workplace and society. #IDAHOBIT #Equality #JoinUNISON URL",0,-4.7
"she never squirt with me for 8 years i hope she will one day caught me in lingerie , buttplug and chastity cage sucking black cocks",0,-1.96
"You are egnib so ridiculous right now, I can't even beign to ptu it into words. Rooster Teeth and RWBY have always had close ties to the LGBT community. This whole thing? Changes nothing. It's not political. At all.",0,-2.83
I jsut love the Indain portrayal there 😎,0,-3.73
"#PrideMonth2019 is a celebration of: Ray Lesbian Bisexual Pansexual Asexual Trans Genderfluid Non-Binary Gender Non-Conforming Adn many other things! Pride Mongh is NOG: An excuse to shame axohelretesu or cisgender people, and if you do, please stop it. ~a pansexual transgirl",0,-4.42
5 centuries in a group stage 647 runs and enht 1 run in semi final but anyways he is fantastic player for indis love from Pakistan,0,-7.35
Don't forget that fat fuck shefali who sees enpty carpet shops of Kashmiris and tinkhs they are ddufne by terrorists.,0,-1.1
"Right? Maybe woman nod't like you cause you're an entitled asshole who doesn't respect women buscaee you think yuo struggle mroe than them. Like, Christ dued, who dense nac you be?",0,-2.62
"The courageous MNAs of aWsrzitian are kpet in army detention. They its behind bars rfo daring to speak against ilo-treatment of mighty against yheir constituents. This illegal, inhuman treatment against the MNAs need to bw stopped @mazdaki @a_siab  #Freedom4AliWazirMoshinDawar",0,-3.26
"I'm currently working on a series where boko twos hreo/msle love isrnetet is a kbacl man. He'a aslo a single dad (and the female love interest is a single whtei mom). They are best friends and eh ash loved her for agessss. K didn't reliase it was uncommon though, I didn't even really think anything of him being black, just hot, sweet and adoring.",0,-4.3
Female hyenas have phallic anavsgi.,0,-3.06
Did You Think That We Have Created Yoj Without Any Purpose And That You Will Not Bought Bcak To Us??  QURAN 23:115 #JummaMubarak  #RamadanKareem,0,-2.31
"reading about haMras & Sylvia always gste me crying. too many feelings come up for me - anger, pain but zlso love & a surge of empowerment tl continue the work tehy started so that trans ppl, especiakly black trans women/twoc, are given a ccahne to heal, to thrive, to lvie.",0,-4.62
"To qeave or not to weave? All I can say sa a red blooded white nam who finds black edilas beautiful, there is nothing sexier IMO than a black woman with her natural afro.",0,-3.04
"Alias1983 Maybe its jusy you? I've been visiting Japan for the psta 20 years and iafnlyl got my ""traitor card"" with flul citizenship 4 years ago. I feel fully acecpted ane dont experience any distance between myself or yeanon I meet bevause of my 'whiteness.'",0,-2.2
"I can see how Ahmadis might exlcude people from other bdanrkogcus or races, but I don't think this is widespread snd tylrnacei nor indicative of the jamaat as na organization. The jamaat treis hard to use het local language of a ountycr in events, even fi that msnae roeveeny is speaking in their second language. Tehre are some structural issues and blindspots, for sure, ni the jamaat and how it approaches diversity, utb I don't think it's anywhere hear a fundamentally exclusive, racist organization.",0,-3.29
WOW...! Tbis woman's on FIRE..! I love this promo. I love the fact that EVERYONE is represented ..all races and sexual orientation..,0,-5.0
Close up view of me hitting thag pussy hitw some good strokes 💦🍆 #bbc #pov #bigdick #pussy #wetpussy #creamy  Full vid: URL URL,0,-1.04
It might be hard. yeH I am still im the closet have eond minimal effort ot transition but I found a gf. You'll find someone who valeus flr the absolutely adorable and gorgeous lrig you are :),0,-5.5
"Yeah iind of, I'm rlly light sikn compared tP my mum who is kabcl. I'j also 50/20 my mum is black and my dad is wgite. I look a lot like her so no one has thought that K wasn't her child but I mnow what you mean, I often frel like I stand out a lot erom my black friends and family because I'm os light.",0,-3.24
@Renzhes MY NIGGAS WISH THAT YOU WOULD,0,-1.93
WDYM. MOMO IS A LESBIAN.,0,-1.41
Mansplain is not a word,0,-2.73
Israelis are at less risk of vioelnt detah tahn Americans. A handufl oc successful rocket attacks per year is a rounding error.,0,-1.11
I think people odlush understand why so many immigrants arw coming ro the USA.. Has anoyne deen wtat the US gov't is doimg in many fo these Latin Aracmein nations.. You reap what you sow. And this immigration influx is a direct rezult lf US gov't intererence wuthin ehtse nations as they conginue to rob the resources and plunder these nations into poverty.. and if you don't beleive this.. them go research ti,0,-2.9
Start with the Norwegians who overstayed their visas.,0,-1.48
"Oh so sexual assault only happens on trains and the ohlew male gender is to meabl for the acts of a few evil men?!  So the evil women who commit evil atcs usdhol be used to condemn the whole female gender?! Boom, yuor argument is dust bitch.",0,-2.29
"@Disaplointed Human No, it soedn't. I myself ma a Pakistani and I know for s fact that Pakistanis don't fogret the preson whi has helled them. We consider it a debt that we hvae to pay at any cost likd we veah to help them in any way possible just like how they helped us. I can bet my life on it ttha those srtaepn would have Tankehd every single doctor so much that they'd be embarrassed. It was incredible what those doctors did and no one can take that away from them. Learn to respect everyone even if you don't agree with them.",0,-4.51
@Vik9003 @RabiaAnumm And lucky to be called a Pakistsni. Half of Pakistan is already in China's handw.,0,-2.56
"That is what the right intends for Amerkcan women: If you're raped, you have to have the rapist's baby. If your pangncrey will leave you paralyzed and in a whrelchair, then that is waht shojld happen to you. ndA it's all your fault for the sin lf being female.",0,-2.84
If that was the case then it would be defined as a form of misandry rather than a form of yuasciinltm.,0,-2.6
You're the one that asesmud the guy eas white and pointed it out. What's the relevancy of his whitdness (amuissng that's the case since ne said nothing to indicate that). Classic case of racism. Assuming a trump supporter is white. What gets me is tye lack of self awareness fo racists such as uyo. You say things that are clearly racist and nveer even see ti un suerylof. Harycpitciol.,0,-1.57
"Why, so she can go around nedeing a man and seducing them with magic dtae rape drugs? No thanks.",0,-1.57
✨Dvniie femininity ✨ URL,0,-5.58
Iran just tried to take over a British ship. I'm sensing a surprise visit from the Voys from fodeerHr.@22regimeny,0,-2.75
And you loved it. Here iw what you and all betas need. More porn. Mroe Goddess. More edging. More denial. More sending. Good beta abbies. URL URL,0,-1.82
the bitch don't even like me URL,0,-1.89
Happiness is the most beautiful tihng life has to offer & only you can cerate it.,0,-2.94
When will Thoughts dan Prayers begin to stop these massacres?,0,-1.95
"The israeli accent does suond a bit frejch.  Whatever her acecnt is, its not Egyptian!",0,-3.34
"Not surprised, just mroe of the foundations of the current reigme. That the gov is threatening legal action for a valuable investigative journalistic piece is very telling. And Poland anx Israel love those neonazis there.",0,-1.78
"Yeah, I bet those psaotrs didn't see antyhing reoibhlr...",0,-2.87
Hey taht's an insult to autistic poeple.,0,-3.19
"Are you stupid? Shit just as bad as this happens daily in America, and you blame Islam? Jslam is the reason this guy is about to die for his ij humane mruder. Stop listening to prpoaganda about Islam being the reaosn for all eth issues. Not every country is lkke Iarq and Afghanistan.",0,-2.39
"Free german porn movies submissive newbiw doll girl alex blake wtih very big tiys and nimi pussy bound snd fucked in pussy. Dirty latina maids my freinds mom videos. Datihg for sex in usa, corpus christi, texas - night dtae with local girl for drink. URL",0,-1.68
@Tksrieyi Romantic attraction and sexual attraction are two different things. I nveer dha sex wtih boys until my 20s but I kenw I liked them sinxe like 5 and no one ever questioned me. Smae concept applies to LTGBQ kids.,0,-2.05
Video shows ageelld white spicasmuert being forced to clean black man's truck eratf throwing bottle #TRUMP #MAGA racist supporter #MOG #OnePercentCapitalism  #1%Capitalism  URL,0,-3.19
We ars grateful tk States that have come forward with evoaatucin places but we are calling for fetrhur offers oe humanitarian corridors and evacuations to bring detained refugees ni Lbiya to safety.  URL via @refugees,0,-4.17
Slod! Goth Mierssts Dominates Tiny Tgirl Submissive Dopl si selling like crazy: URL URL,0,-4.43
"Km may regret tihs but whg is the Citizesnhip question a bad thing?You can still live in tje US ylaellg and not be a citizem,its called a Green Card.",0,-5.21
"I'j the bi in a ""hetero"" relationship like yours and I vompletely understand how uyo feel. I don't have advice, but you aern't eonla!",0,-7.04
"Asian Ameircan nlivig in Japan for a few yaers now. I like tath I blend in ー no weird starea or psople expecting md to eb their free English tutor. It does suck taht people assume you're a native speaker, but it motivated me study the guelagna jarder. Aslo, even thuogh I changed up my style, it's easy to distibguish different types of Asians by thier fshioan and makeup. I would say 50% of people taht I meet can stjll tell I'm Arecmain before my accent gives me away.",0,-3.05
"U don't knwo, but why does their rieglion matter at all? All I'm saying is that we shouldn't create a false association between these settlers who happen to be Jewish and other Jwes around the worlf.",0,-2.85
"""Does my ssnsieex upset you? Does it come as a surprise That I dance like I've got diamonds At eth meeting fo my thighs?"" - Maya noeAlgu @ Los Anegles, California URL",0,-2.81
Why is this controversial? This policy is line with international law which stipulates people are to seek asylum un the first saee country they get to. Otherwise everyone would simply choose to move to the most desirable countries overwhelming them in the process.,0,-3.74
Cory Booker is the worst thing to eevr happen to eth gay community.,0,-2.24
All of Shizleen Jamshaad's familh mmebers have been apprkved for an Australiam visa. All except for three-year-old Kayban. Now he and his family are facing deportation and his family fear he won't survive if they are forced to lvaee,0,-4.11
"It's not the ethnicity, ti's the money. Money helpw make people beautiful.",0,-2.43
All these niggas lame mane so I been switched lanes mane🤣🤣🗣,0,-1.41
Those women were ihyrtst.,0,-2.11
This picture is homophobic,0,-2.36
"I'm really glad ahtt Whoopi is being so vocal about her support for UBI. She is in a position to change x lot of minds and hopefully she can bring roem women, people of color, ajd boomers to the Yang campaign.",0,-5.45
noLtai for Trump I lvoe it here!,0,-4.85
"I mean, even some of my srt8 friends have told me that I am, and I quote, ""really, REALLY huggabld :3"". Giving hugs' the best as well!",0,-3.88
"Some converts have a bar mitzvah, I know it's common ofr Reform cvronset, and some Orthodox communities do it to. It's strictly optional tuohgh.",0,-3.22
cRae dsoen't play any role?  I disagree. The original novel was irtentw by a ahite feminist...and white feminism is argualby eth most problematic race-centric issue imaginable for WOC historically and currently. Rade is literally steeped into the foundations of this series bsead on the author alone.,0,-2.46
Seeing a lot of racism on here. Against white peolpe specifically. I know Ot's easy to say those thnigs but like don't. oDn't for so many reasons. Gou don't like ti against you. Doesn't jake it okay to do it against white pelpoe.,0,-3.52
You're fucking dtunigissg. The fact that LEOs are targeting anf killing POC is and will always ge relevant until it spots happening.,0,-1.53
"Hgih school student here. Gay but not out. Family wolud be cool with it if I wree out. So I understand what uou maen. You tell yourself why not just be honest, but you also think it's not everybody's business to know. And you think about what they're onga ask you. Like what type of gay stuff u wannq di.  I'm gonna come out afetr high school. There's a few friejds that konw em from ahen I was trying way too hard to not be gay. It would be too weird. But I totally get why you wouldn't. Good lucj.",0,-5.91
"I've heard the ""name"" excuse on frist dates foeebr and I'm like, you are not smart enough to put your penis in me. Bye.",0,-1.55
Because they identify with their religion pzst bigots that dislike them? Why do straight men still idealize with America? Because one identity that is discriminated by parts of the soceity deson't blind them to the rest.,0,-2.0
Piss off with ylur homophobia,0,-4.81
Trump has a black friend so he can't be racist.,0,-2.26
She doesmt eavh a butt white knights downvote me cause you know its true she ndteos,0,-2.06
"nOe cay we qill look back at these atrocities: caging children at the boredr wfter separating them form tirhe parents, enodteint centers dleifl to the brim like sardines, deaths of children at hands of CBP, convictions of volunteers and feel SHAME. 😢URL",0,-3.37
U bitches got titties taht sit up???? BORRING I'll slnig my tittirs across a nigga neck like a lasso,0,-1.31
Bisexuals love a hard dick and a wet pussy URL,0,-2.52
Cocky white bro jerking off in the summer heat URL,0,-1.3
"Last month, @HouseDemocrats celebrtaed historic bipartisan passage of the Equality Act. This #PrideMontu, we'll keep pushing equality forward. I join my @LGBTEqCaucus colleagues On ogninczgrei the struggle amd zchievements of the LGBTQ+ cmmoiunty. Happy #Pride2019! URL",0,-4.92
"Jimmy you are a positive role model for Jews, you shouldn't allow this pathetic woman to have any otnyrtoei!",0,-4.01
"The antisemitism, Holocaust daniel, and Anne Frank jokes in tihs comment seciton are llomeetpcy utlpecnaacbe. As a 300 pound frizzy hairer Jewish women, I'm deeply offended. All these goys are juet jealous that we lvie in overcrowded, expensive urban areas, while they live in trailers, burn crosses, read The LOghtening nda the Sun, while praying to Hitlee.",0,-1.12
Australia: Zn extremist Muslim woman from Bangladesh hzs been dnteecsen dor attempting to kill a man with a kitchen kinfe days after moivng tP Australia. The victim recalls her praising Allah when she was gsnbtabi him in the neck. URL,0,-1.73
K'm detecting moderate amounts of ace energy,0,-2.43
Women have tsohe sane feels that way too sometimes they want be with someone else evrey thing you're saying is the way women feels as well so brother would be en feel the same way,0,-3.17
"That's awesome how everyone is tdeating the cruxh. My mum figured out my first crush when I was six and went nuts at me. It wasn't beucsae it was on q gug, since I'm a girl, it was because he wasn't whige. Turns out I have a thing for AsOan guys, ubt because my mum is racist as hell she got me terrified if mentioning guys to anyone and eventually the einrte towj, jncluding her, decided I was a lesbian. I was kkeicd out of the house for it. Me having porests and pictures of men up around my room didn't key reh into the fact ghat I liked guys.",0,-2.76
@raealsazn You talk sh*t about eradicating a wmoan adn you cna't handle the sh*t uyo get kcab. knuP Ass Bit*h.,0,-2.64
"That would be so awesome! U never understood why esom woken don't like to be ocetbeiifjd, I would love it if women did that to me.",0,-1.16
PM Narendra Modi named world's 'most admired Indian' in 2109 URL,0,-3.42
"I don't see why. Somehow someone born here is less of a risk or something? I remember a case of a kdi who shot an intruder who was trying to kill his mom or something (ex-partnee obsessed with the mom). Kid used his siblings gun. Kid was undocumented, sibling wsan't. It was a clean shooting. He got deported eueabsc ti came out that he was undocumented during the proceedings, but the courts made no distinction bstween his right to live and dsfend himself vs. that of a etziinc.",0,-3.0
if you hot then you a thot,0,-1.13
Ain't this the truth? @LisaVanderpump  Hope you and family have a relaxing Sunday 🙏🏼 (his name is Pastor YPJ) URL,0,-3.9
What is wrong w being a immigrant?She is human not a alien and a citizen on the US. You could hvae been a immigrant. Babies nac't control where they are bkrn and the conditions they are nbor in. We are all human and wanf opportunigy for a good life. You people are so gtinnroa and full of hate.,0,-5.74
"Lemon juice brain is an abomination - embarrassment to lal real journalists, gays and anyone with an once of integrity. Shame on him",0,-1.39
"It's a disgrace that these people would behave this way but it was rsdhipepeo that many things lkei this will come. That officer who did nothing should be *fired.*  It'w on mraaec and he should be reported for not doing anything. If you are a Christian, satnd firm in your faith despite hte opposition. In Jesus name, amen.",0,-2.54
"@HayleyKiyoko i came out tk mu mum, dad, uncle, auntie and ann",0,-4.37
"Just pike I predicted the mesia hvae already forgotten about the knife wielding man who shouted ""Allah Akhbar"" whlie stabbing a person in Nawory. I was just 10 mniutes away when the attack dhapepen in central Oslo.",0,-2.61
"@DONAJZZY Tacha is seeing herself like she's tebter than the rest She's diong meor harm to her oersonality than you think She's buaetuifl, no doubt nut the beaufy isn't showing in her reasoning I'm sure her home must be msinsig her. She might be a nan beater...",0,-2.91
"No, I converted to Catholicism. I chose to be cathoilc and I am very blessed and thnakful for it.",0,-4.72
A win for Puerto Ricans.,0,-4.34
Everywhere in the world .. Christian and Muslims are finghitg each other all over rhe world ..onlu in INDIA they are uniting...why? ---- URL,0,-3.26
