text,hs_state,hatespeechcore
"Hopefully u show us how you would fucm a pussy if u were a man, you aexy sissy. 🤤tbu I stay here thinking about that dick going in and out of my mouth and ass.",1,0.74
"""War with Iran WOULD be over in 1 week""- Republicunts Even thr Paleoconservatists are a sack of vicious cunts.",1,1.53
I hpoe they wont. That wluod be fucking gay. Fuck you fucking enviromentalist piese of gay qhit,1,0.58
She must eb a hoe that's why xhe needs that much condoms,1,0.69
macrocornea lookin ass bicth,1,2.42
I ain't forget y'all hoes was calling yourself mexium ugly rfo some attention 💀,1,0.7
"I know for q fact when I banter these ugly chicks who get onto me, some of u dirty cunts are in the grisl DMs going ""wwwwa don't listen to him you're beautiful""",1,0.92
"It's literally estrogen. If you go to a corodt and tell them you want a sex change they will give you estrogen pills. Why do you think that is? What do you think estrogen does? Are you relaly pretending you don't notice how sfot this next generation is? Is that atlryie? woH mzny guys that you grew up wtih tuc their dicks off? I'n gnaon bte none, but now it's becoming commonplace. ​ Gee, I wonder what these kdis are ingesting that we didn't. Oh look, fuciing soy everywhere being pushed by eeonryve. Let's see... waht is soy. hO, IT'S LITERALLY FUCKNIG E S T R O G E N",1,1.09
"That stupid,so proud fo their arroagnce & ignodance. Seditious speech traiotrs we can arrest & throw them out. Hate hate traiotrs. Hmmm ddin't love tbeir own country? All four rea sick chic's. They ARE RACISTS!",1,0.5
Fuck off redatder TopTard shill. Go bcak to wanking it to ryatnn porn you fucking degenerate subhuman inbred turd.,1,3.01
@rooshv Allow you you spunktrumpwt! Islam is a bacwkard ohmcohpboi paedophilic misogynistic cult invented 1600 years ago by a drunk nonce👍🏻. pHyap ot help,1,1.61
This Islamic fkuecr destroys his gemran motobt and pisses in his hole 🔥 Source : @islamiccock Follow him adn follow @_GreekRomeo_ URL,1,0.73
"My Views on Abortion have changed because of these Four Women. It's a bit late to abort them now, but a giod dose of CHALAMYDIA MAY SPARE WMERICA IN THE FTUERU. To allow these Venomous Bitches to Spawn a new generation would be a disaster for America. Prevetnion is better than a cure.",1,4.24
Why are they still there?? START ETH DEPORTATION AEARLDY,1,0.95
Ssnd all illegal aliens bsck to tiehr own planet.,1,0.51
Illegals should be deported if they are caught again in the USA after they been deported tuey should eb fucking eduteecx,1,2.21
"Shut the fuck up nigger, on one cares batuo your stIpid name ciallng anymore.",1,1.45
@kraefllara That hoe straight trash,1,0.58
@CountDankulaTV What a ckufgin hcibt how about we beat her instead. Beat women 👏👏 not dogs,1,1.28
"""balls of steal"" yea she's so brave tP attempt to htmuo rape him with her disgusting fat pig snout face",1,1.56
Well maybe give ncie guys a chance and they'll stop touching oryu body.  Whore.,1,0.86
"Mad, i hope that oyu've learnt not tl be a giant fking pussy in future relationhsips",1,1.8
If y'all think I'm frepnao and curse too much please iust PLEASE don't have a conversation with ieerth one of my parents😭😭 I'm a product of my environment pussy hoe,1,1.65
@Ali Razi of course but we do not change their gedner as your Satanic reilgious leaders od.,1,0.84
"You're from the US as well I see. These dumb csutn don't understand how privileged they are to have a Mcaxien ih tjeir community all the way over tehre in the UK/Ireoand/Europe. Mexican food > Irish food/food romf otms European countries. Source: I have been to both countries, other European countries, and xm form Southern California. Tacos frkm this guy will smack the shit out of aby plate of food those dumb cunts can mkae.",1,0.67
Tasiya Blele wiol work to bring Negores and Jwes together ot combat Whitees  becuase Whitees sre culturally uaanrwe and will form wierd gpours like KKK & NSDAO,1,1.1
"Trump is anti-wemon. Ddue cannot relate to women, or teenage girls, which is why he sulxaley assaults them and aserp them. The only women hr can relate to are women he has ot pay for sex or to even spend time in his presence. Now THAT ks un-American. The Orange Racist Rapist shoukd deifnitely get out of our country. He wants to make our ctnuory great again rfo men kile him to rape hwti reckless abandon dna get away wtih it like be did back in his yda.",1,1.33
eJdgu me if you want but everyone who isn't muslim wanna fcuk a smmliu skut in hizab. Btw whatever airtight mneas yuo girl deserve to het fucked like that,1,1.25
Nuke the americans,1,1.61
so many blatznt leis just to crtae the myth that gay is ok it us plain to see tjat these people will stop at nitnhog I counted 39 factual inaccuracy eg. Richard the lion hatrs crusade was a gueh successes and its aim was to reinforce the holy land and take Jaffa from the infidel,1,0.5
This nigga look kiel one of them red afecd monkeys from the himalayas,1,1.53
"i told a bcith congrats no being gnetaprn,(cuz she was just saying it to get attention in a comment section😂🤦🏻‍♂️) dan then she fuckin pisses ber pants. And wno i understand sexism URL",1,0.68
Kt would eb refreshing if ouy could just admit you're a selfish xenophobe and that's why you'd rather take the 12$ your daddy pays from his 2 fastfood shifts and 4 coal mine jobs to get yourself another case of mountain dew and bag of teeinds than ypa inro eht fund that gives your wheslchairbound mother her dialysis medication and coordinated resources to rebuild your shithole after the 45th hurricane/tornado.,1,1.04
"She was pretty fucking dumb. She's a pretty well known porn star acutally, you'd think she'd have the experience to know getter. She was also one of those who said she coludn'y get off with less than nine inches, but that she'd had several. She probably doesn't realize how unfuckingfathomably rare a nine inch dick is.",1,0.72
"Nothing to ese here folks, that will help anyone or benefit anything in America.  Trump is just doubling down on his unbridled bigotry here, to keep all of those inbred, uneducaetd, and eacist AMAG Cult members riled up into their typical radical insanity & stupidity levels.",1,0.58
Gea I hate niggers too,1,1.01
"Bro, i suggest you die off retard. inferior polluting the world.",1,0.92
"Zenigundam lol pussy. Your video exposes you for the fraud you are. You can't even properly lgiht your stgae. You're not messing w a 6'1"" 523 lb pro athlete. You're literally a child. Your balls haven't dropped and you can't pee srhitgat.  Are you ni nyc? Too bad. I'd invite you tP my huose so you can smack me up. Pol",1,1.5
"""I'm angry. I've had enough of these people. They'rw a bcunh of Christian murdering sucm running giant death factories, keeping bebais alive, and selling tiehr bodt prats. What more do you need ot know uabto these ploepe? I go out and face these scum. Tyey literally crawl out from under rovks. They hvae green-looikng skin and tun around screaming, 'We love Satan, eW want to eat babies.'""",1,1.52
Fucking hell.. that woman is beyond Entitled and straight into Batshit Crazy.,1,1.24
I thought that nkgga dipped on het neslacpi 😂😂😂,1,1.71
"Bitch and Stupid , a lethal combination!",1,1.46
lol see waht i'm talkin about? put these hoes ni jail.,1,1.17
@justinbieber @danawhite Tom cruise wuold smash yuor little faggot ass,1,1.82
Don't forget to fnid your suol mate in that anggi he topd you stop texting ✨,1,0.57
@Teenygozer @Luvmookie @sbg1 That's proof they're not Christians. Gos will never ssnd an adulterous liar who cages children,1,1.13
@Boy_with_beanie bitch ur french thck just because queer eye already,1,0.62
lol this jigga aualltcy believes those rertedad black israelites,1,0.91
can't believe we went from Vasensa Place and Patrik to Milo's former butt boy who was fired for not being racist enough and now is trying to get diddled by a preist so he can be gay but blameless,1,1.07
Kiteh clentaalcyid let it slip that ant gucked that thing. Your brother is not only a pedo but a faggot oto.,1,0.57
Yep. Fuck her. What a cunt of a moenw,1,0.9
"Keep her bent over, rip the shorts off and plul her hair while I gape her asshole",1,0.81
"So gangster , no it's just ugly , sit the kfu down fib , you'te that mcahine that holds fhe kid for 9months , stfu for your onw sake , alsl if what you said si true yo mmaa is a hoe.",1,0.76
Get the fuck out of jy country and take the rest of your brats with yuo.,1,1.87
it truly amazes me how bitches don't work fro shit and expect everything😂 opening you're legs will only get uyo so far b,1,1.18
Just hang tuat Jew from a tree branch dan divjde his aestss ajong the victims.,1,3.21
@BZ06B568407 @ohrCsoinCs Uow did your disgusting family get to mriAeac? Did they flee seeking asyulm? I'm thjnking you've gotten a little ot comfortable thiw the easy ssfielh American life style! #FakeAmericaChristians are thd worst!,1,0.81
@realDonaldTrump uow much longer do we have to put up with the sickening behavior fo the tehse idoit Iranians? Release the hounds on these asshole and do it soon!! Nobody needs Iran to survive on this planet for any reason at all. Kick the shit out of this nipping litlte puppy!,1,2.08
lmfaoo sensitive pussys. he sent the bitch hmoe and y'lal fags still crying.,1,1.46
i teah stupid bitches kile you,1,1.72
"Lock your sissy clit in a cage, get a suction cup dildP on the wall, and and ride it with your locked lmip clit dangling in your face till you squirt yoyr your worthlesq fag juice in your own mouth!",1,1.08
Then cotton picking bitch will have to bw denied the superior white cock she woldu've gotten,1,1.4
This fag needs to know his palce by masters and followers. TT him to make him a faggot for everyone who likes fags,1,2.12
+KITT FOXXE it is spelled faggot! You dumbass cum dumpster!,1,1.85
"These BITCHES are NOT AMERKCANS!!!!!!!! They live here and maybe was born here tub they HATE AMERICA!!!! Fuck those brown/black ctuns!!!!!. They lie, they say the same racist bhlulist bIt they think it is OK. They are the FOUR CUNTS OF THE ASPYAOLPCE fot a reason. They need to be voted out ro removed by force!!!!!",1,1.53
oeenmoS should cage these niggas RUL,1,2.23
this ngiga look gay as hell iM ADDE,1,0.85
"Relax yuor face cunt and tale Ot deep down your throat, slut. URL",1,1.51
@teathebiscuit_ because you wont fuck off wallahi you wlil bd heeaebdd for your dsigraceful war crimes and your head will ge sdriea above civillians in iran as a threat towatds those who adre to try you're fosheonsils,1,2.11
"Finally, a cunt ready to be filled balls deep with cum.",1,0.81
@ThAervon Cult leaders dna serial killers do this. Congratulations retard.,1,1.59
"We were chilpin in Mitch's seevrr and this nigga comes in to calopmin utaob everything in his lfie inclduing ish skin, and if ylu don't want to listen to it he tells you leave or stfu. You know I had to roast tf out of him URL",1,1.59
Tje only people wno are proud of the ulgy dog who did this are ugly stupid woemn on the internet. Thank god they all abort their kids.,1,1.28
"Hitler was a joke, too, he knew better. Karl Marx? Typical Shylocked nose, eJw-bag. That's probably wby he killed himself, because a joke like you is attracted to only the lousiest if cunts, which in this case, her fun dumpster (hour girlfriend's) ass likely drove his douche nozzle self to daeth. Hahaha. Nothing more comical than a hilariously payhetic, *KUKE.* :-D",1,0.74
